{
  "v": "0.1",
  "catalog": "classical-pack",
  "title": "Public Domain Classical Pack",
  "artist": "Various (Public Domain)",
  "license": "CC0-1.0",
  "license_url": "https://creativecommons.org/publicdomain/zero/1.0/",
  "attribution": "Public domain recordings curated by 1bit.systems",
  "source": "https://musopen.org/",
  "created": "2026-04-23T12:34:56Z",
  "tier": "premium",
  "codec": {
    "audio": "mimi-12hz",
    "sample_rate": 48000,
    "channels": 2
  },
  "model": {
    "arch": "bitnet-1p58",
    "params": 33554432,
    "bpw": 1.58,
    "sha256": "9f86d081884c7d659a2feaa0c55ad015a3bf4f1b2b0b822cd15d6c15b0f00a08"
  },
  "tracks": [
    {
      "id": "01",
      "title": "Moonlight Sonata — Adagio Sostenuto",
      "length_ms": 375000,
      "sha256": "60303ae22b998861bce3b28f33eec1be758a213c86c93c076dbe9f558c11c752"
    },
    {
      "id": "02",
      "title": "Air on the G String",
      "length_ms": 312000,
      "sha256": "fcde2b2edba56bf408601fb721fe9b5c338d10ee429ea04fae5511b68fbf8fb9"
    },
    {
      "id": "03",
      "title": "Clair de Lune",
      "length_ms": 290000,
      "sha256": "a1fce4363854ff888cff4b8e7875d600c2682390412a8cf79b37d0b11148b0fa"
    }
  ],
  "residual_present": true,
  "residual_sha256": "4b227777d4dd1fc61c6f884f48641d02b4d121d3fd328cb08b5531fcacdabf8a"
}
